{
  "schema_version": "1.0.0",
  "generated_at": null,
  "curation": "manual_phase2_seed",
  "source_files": [
    "docs/reports/optimierungsstatus.md",
    "docs/reports/auth-status-matrix.json",
    "docs/reports/map-status-matrix.json",
    "docs/tasks/board.md"
  ],
  "tasks": [
    {
      "id": "DEPLOY-DNS-001",
      "title": "INWX Registrar/DNS Cutover vorbereiten und durchführen",
      "area": "infra",
      "status": "partial",
      "priority": "high",
      "effort": "M",
      "risk": "high",
      "owner": "unknown",
      "evidence": [
        "docs/adr/ADR-0008__domain-mail-provider-boundaries.md",
        "docs/deploy/domain-mail-migration-ionos-to-inwx-mailbox-brevo.md",
        "docs/reports/domain-provider-role-finding.md",
        "externe Audit-Artefakte (keine privaten Rohdaten im Repo)",
        "apps/web/static/weltweberei/index.html",
        "apps/web/static/weltweberei/styles.css",
        "apps/web/tests/weltweberei-information.spec.ts",
        "docs/deploy/secondary-domain-web-surfaces.md"
      ],
      "missing_evidence": [
        "Autoritative INWX-Delegation für weltweb.net ist noch nicht belegt",
        "Permanenter Redirect und HTTPS für weltweb.net sind noch nicht belegt",
        "Autoritative INWX-Delegation für weltweberei.org ist noch nicht belegt",
        "Informationsseite und HTTPS für weltweberei.org sind noch nicht belegt",
        "Öffentliche und autoritative No-Mail-Records für beide Nebendomains sind noch nicht belegt",
        "Das Heimserver-Edge-Template enthält den Redirect- und Static-Surface-Vertrag noch nicht nachweislich",
        "Die aktive Edge-Konfiguration ist noch nicht gegen das Heimserver-Template abgeglichen",
        "Das öffentliche Runtime-Verhalten von weltweb.net und weltweberei.org ist noch nicht nachgewiesen"
      ],
      "acceptance": [
        "weltweb.net ist auf INWX delegiert",
        "permanenter Redirect auf weltgewebe.net funktioniert",
        "weltweberei.org ist auf INWX delegiert",
        "Informationsseite funktioniert",
        "beide Domains besitzen öffentlich und autoritativ belegte No-Mail-Records",
        "danach Taskabschluss prüfen"
      ],
      "links": {
        "issues": [],
        "prs": [],
        "docs": [
          "docs/adr/ADR-0008__domain-mail-provider-boundaries.md",
          "docs/deploy/domain-mail-migration-ionos-to-inwx-mailbox-brevo.md",
          "docs/reports/domain-provider-role-finding.md"
        ]
      },
      "updated_at": "2026-06-23"
    },
    {
      "id": "DEPLOY-DNS-002",
      "title": "Historischer INWX-Zonencheck; Pre-Delegation-Annahme superseded",
      "area": "infra",
      "status": "done",
      "priority": "high",
      "effort": "S",
      "risk": "low",
      "owner": "unknown",
      "evidence": [
        "docs/tasks/DEPLOY-DNS-001B.md",
        "externe Audit-Artefakte"
      ],
      "acceptance": [
        "Historische Checklisten bleiben Evidenz; die operative Pre-Delegation-Annahme ist durch DEPLOY-DNS-001 und das abrupte Aktivierungsfenster superseded"
      ],
      "links": {
        "docs": [
          "docs/tasks/DEPLOY-DNS-001B.md"
        ],
        "issues": [],
        "prs": []
      },
      "missing_evidence": [],
      "updated_at": "2026-06-06"
    },
    {
      "id": "TASK-CTL-001",
      "title": "Task-Control Phase 2 etablieren",
      "area": "docs",
      "status": "done",
      "priority": "high",
      "effort": "M",
      "risk": "medium",
      "owner": "unknown",
      "evidence": [
        "docs/tasks/README.md",
        "docs/tasks/board.md",
        "docs/tasks/index.json",
        "docs/tasks/schema.json",
        "docs/reports/optimierungsstatus.json",
        "scripts/docmeta/validate_task_index.py",
        "scripts/docmeta/tests/test_validate_task_index.py"
      ],
      "missing_evidence": [],
      "acceptance": [
        "docs/tasks/ existiert und alle Phase-2-Artefakte sind vorhanden",
        "Validator läuft mit exit 0 gegen docs/tasks/index.json",
        "README, CONTRIBUTING und docs/index.md beschreiben Task-Control korrekt"
      ],
      "links": {
        "issues": [],
        "prs": [],
        "docs": [
          "docs/tasks/README.md",
          "docs/tasks/board.md"
        ]
      },
      "updated_at": "2026-05-28"
    },
    {
      "id": "TASK-CTL-002",
      "title": "GitHub-native Arbeitsobjekte minimal evaluieren",
      "area": "governance",
      "status": "done",
      "priority": "low",
      "effort": "S",
      "risk": "low",
      "owner": "unknown",
      "evidence": [
        "CONTRIBUTING.md",
        "docs/tasks/board.md",
        "docs/blueprints/doc-structure-task-control.md"
      ],
      "missing_evidence": [],
      "acceptance": [
        "Entscheidung dokumentiert in CONTRIBUTING.md und board.md",
        "Kein Artefakt unter .github/ISSUE_TEMPLATE/ oder .github/pull_request_template.md ohne belegten Nutzen eingeführt"
      ],
      "links": {
        "issues": [],
        "prs": [],
        "docs": [
          "docs/blueprints/doc-structure-task-control.md"
        ]
      },
      "updated_at": "2026-06-29"
    },
    {
      "id": "TASK-CTL-003",
      "title": "Task-Index Generator und CI-Guard einführen",
      "area": "ci",
      "status": "done",
      "priority": "medium",
      "effort": "M",
      "risk": "medium",
      "owner": "unknown",
      "evidence": [
        "scripts/docmeta/generate_task_index.py",
        "scripts/docmeta/tests/test_generate_task_index.py",
        "scripts/docmeta/agent_entrypoint_smoke.py",
        "scripts/docmeta/tests/test_agent_entrypoint_smoke.py",
        ".github/workflows/task-index.yml",
        "PR-CI-Lauf 27643872404 (pull_request, PR #1209, Commit 7cb5ec3364e1f47562574ca6fc729679c5056b29): task-index grün"
      ],
      "missing_evidence": [],
      "acceptance": [
        "Generator erzeugt oder prüft docs/tasks/index.json deterministisch (--check-Modus)",
        "CI prüft Drift zwischen board.md, index.json und optimierungsstatus.json, schreibt aber nicht still",
        "Fehlende Evidenz wird gemeldet, nicht geglättet",
        "docs/_generated/* werden nicht manuell geändert"
      ],
      "links": {
        "issues": [],
        "prs": [],
        "docs": [
          "docs/blueprints/doc-structure-task-control-roadmap.md"
        ]
      },
      "updated_at": "2026-06-17"
    },
    {
      "id": "TASK-CTL-004",
      "title": "Guard gegen uneingeordnete Blueprints und Pläne einführen",
      "area": "docs",
      "status": "done",
      "priority": "medium",
      "effort": "M",
      "risk": "medium",
      "owner": "unknown",
      "evidence": [
        "docs/blueprints/blueprint-agent-safety-control-layer.md",
        "docs/roadmap.md",
        "docs/tasks/board.md",
        "docs/tasks/index.json",
        "scripts/docmeta/check_planning_registration.py",
        "scripts/docmeta/planning_registration.yml",
        "scripts/docmeta/tests/test_check_planning_registration.py",
        ".github/workflows/task-index.yml"
      ],
      "missing_evidence": [],
      "acceptance": [
        "neuer Blueprint oder Plan ohne Index-/Roadmap-/Task-Control-Einordnung wird im Check-Modus gemeldet",
        "eingeordnete neue Blueprint-/Roadmap-Dateien bestehen den Guard",
        "explizite Ausnahmen sind schema-konform und begründet",
        "Ratchet kann mindestens report-only und warn unterscheiden, bevor blocking aktiviert wird"
      ],
      "links": {
        "issues": [],
        "prs": [],
        "docs": [
          "docs/blueprints/blueprint-agent-safety-control-layer.md",
          "docs/roadmap.md",
          "docs/tasks/board.md"
        ]
      },
      "updated_at": "2026-06-02"
    },
    {
      "id": "AGENT-SAFE-001",
      "title": "Safety-Preflight Guard minimal einführen",
      "area": "governance",
      "status": "done",
      "priority": "high",
      "effort": "M",
      "risk": "high",
      "owner": "unknown",
      "evidence": [
        "scripts/agent/check_agent_preflight.py",
        "scripts/agent/tests/test_check_agent_preflight.py",
        ".github/workflows/agent-safety-preflight.yml",
        "docs/security/agent-write-scope-baseline.md"
      ],
      "missing_evidence": [
        "Blocking-Modus und Write Mode sind nicht Teil dieses report-only Safety-Preflight-Slices"
      ],
      "acceptance": [
        "ein minimaler Preflight prüft vor agentischen Schreiboperationen Task-ID, Ziel, erlaubte Pfade, Claims, erwartete Evidence und Validierungskommandos",
        "fehlende Pflichtfelder blockieren den Task deterministisch statt still weiterzulaufen",
        "der erste Slice bleibt report-only oder warn und setzt keinen Done-Status für Folgepfade"
      ],
      "links": {
        "issues": [],
        "prs": [],
        "docs": [
          "docs/blueprints/blueprint-agent-safety-control-layer.md",
          "docs/roadmap.md",
          "docs/tasks/board.md"
        ]
      },
      "updated_at": "2026-06-26"
    },
    {
      "id": "AGENT-SAFE-002",
      "title": "Readiness Hard Fail für Agent-Fähigkeiten einführen",
      "area": "governance",
      "status": "done",
      "priority": "high",
      "effort": "S",
      "risk": "medium",
      "owner": "unknown",
      "evidence": [
        "scripts/docmeta/generate_agent_readiness.py",
        "scripts/docmeta/tests/test_generate_agent_readiness.py",
        "docs/tasks/board.md"
      ],
      "missing_evidence": [],
      "acceptance": [
        "fehlende als verpflichtend markierte Agent-Fähigkeiten führen zu hard fail statt soft degrade",
        "Capability-Matrix oder äquivalente Quelle unterscheidet optionale und verpflichtende Fähigkeiten",
        "Task-Control und Roadmap behaupten keinen Done-Status ohne belegten Hard-Fail-Mechanismus",
        "offene Capability-Artefakte bleiben explizit sichtbar und laufen in eigenen Folge-Slices"
      ],
      "links": {
        "issues": [],
        "prs": [],
        "docs": [